{
  "schema_version": "amy.selected-profile-oracle.v1-draft",
  "status": "draft_same_author_not_independently_reviewed_not_frozen",
  "source_catalog": {
    "path": "protocol/ATTACK_CATALOG_SELECTED_PROFILE_DRAFT.json",
    "sha256": "098563afc029f8c1532999e3cc5c058c8bf3bdc33cfcfd01423decf56f4693b1",
    "catalog_version": "0.4.0-draft"
  },
  "result_contract": {
    "path": "schemas/selected-profile-fixture-result.schema.json",
    "sha256": "442553ed9bbb291bffd3de20b79d5beb4089dbbaa7ba629f8bb5172a3303930c"
  },
  "derivation_boundary": {
    "source_fields": [
      "cases[].id",
      "cases[].profile_expectations"
    ],
    "observed_results_read": false,
    "confirmatory_cases_read": false,
    "confirmatory_cases_executed": false,
    "target_decisions_used_as_profile_expectations": false,
    "implementation_behavior_used_to_generate_rows": false,
    "independent_human_review_complete": false,
    "classification": "pre_registration_expected_implementation_behavior"
  },
  "profiles": [
    "P0",
    "P1",
    "P2",
    "P3"
  ],
  "case_count": 41,
  "row_count": 164,
  "rows": [
    {
      "case_id": "ATTESTATION-MALFORMED-001",
      "profile_id": "P0",
      "expected_decision": "ACCEPT",
      "expected_primary_reason": "OK",
      "catalog_json_pointer": "/cases/0/profile_expectations/P0"
    },
    {
      "case_id": "ATTESTATION-MALFORMED-001",
      "profile_id": "P1",
      "expected_decision": "ACCEPT",
      "expected_primary_reason": "OK",
      "catalog_json_pointer": "/cases/0/profile_expectations/P1"
    },
    {
      "case_id": "ATTESTATION-MALFORMED-001",
      "profile_id": "P2",
      "expected_decision": "REJECT",
      "expected_primary_reason": "ATTESTATION_INVALID",
      "catalog_json_pointer": "/cases/0/profile_expectations/P2"
    },
    {
      "case_id": "ATTESTATION-MALFORMED-001",
      "profile_id": "P3",
      "expected_decision": "REJECT",
      "expected_primary_reason": "ATTESTATION_INVALID",
      "catalog_json_pointer": "/cases/0/profile_expectations/P3"
    },
    {
      "case_id": "ATTESTATION-MISSING-001",
      "profile_id": "P0",
      "expected_decision": "ACCEPT",
      "expected_primary_reason": "OK",
      "catalog_json_pointer": "/cases/1/profile_expectations/P0"
    },
    {
      "case_id": "ATTESTATION-MISSING-001",
      "profile_id": "P1",
      "expected_decision": "ACCEPT",
      "expected_primary_reason": "OK",
      "catalog_json_pointer": "/cases/1/profile_expectations/P1"
    },
    {
      "case_id": "ATTESTATION-MISSING-001",
      "profile_id": "P2",
      "expected_decision": "REJECT",
      "expected_primary_reason": "ATTESTATION_MISSING",
      "catalog_json_pointer": "/cases/1/profile_expectations/P2"
    },
    {
      "case_id": "ATTESTATION-MISSING-001",
      "profile_id": "P3",
      "expected_decision": "REJECT",
      "expected_primary_reason": "ATTESTATION_MISSING",
      "catalog_json_pointer": "/cases/1/profile_expectations/P3"
    },
    {
      "case_id": "BUILD-DIRTY-001",
      "profile_id": "P0",
      "expected_decision": "ACCEPT",
      "expected_primary_reason": "OK",
      "catalog_json_pointer": "/cases/2/profile_expectations/P0"
    },
    {
      "case_id": "BUILD-DIRTY-001",
      "profile_id": "P1",
      "expected_decision": "ACCEPT",
      "expected_primary_reason": "OK",
      "catalog_json_pointer": "/cases/2/profile_expectations/P1"
    },
    {
      "case_id": "BUILD-DIRTY-001",
      "profile_id": "P2",
      "expected_decision": "ACCEPT",
      "expected_primary_reason": "OK",
      "catalog_json_pointer": "/cases/2/profile_expectations/P2"
    },
    {
      "case_id": "BUILD-DIRTY-001",
      "profile_id": "P3",
      "expected_decision": "REJECT",
      "expected_primary_reason": "DIRTY_BUILD",
      "catalog_json_pointer": "/cases/2/profile_expectations/P3"
    },
    {
      "case_id": "BUILD-METADATA-MISSING-001",
      "profile_id": "P0",
      "expected_decision": "ACCEPT",
      "expected_primary_reason": "OK",
      "catalog_json_pointer": "/cases/3/profile_expectations/P0"
    },
    {
      "case_id": "BUILD-METADATA-MISSING-001",
      "profile_id": "P1",
      "expected_decision": "REJECT",
      "expected_primary_reason": "SCHEMA_INVALID",
      "catalog_json_pointer": "/cases/3/profile_expectations/P1"
    },
    {
      "case_id": "BUILD-METADATA-MISSING-001",
      "profile_id": "P2",
      "expected_decision": "ACCEPT",
      "expected_primary_reason": "OK",
      "catalog_json_pointer": "/cases/3/profile_expectations/P2"
    },
    {
      "case_id": "BUILD-METADATA-MISSING-001",
      "profile_id": "P3",
      "expected_decision": "REJECT",
      "expected_primary_reason": "PROVENANCE_INVALID",
      "catalog_json_pointer": "/cases/3/profile_expectations/P3"
    },
    {
      "case_id": "BUILDER-PREDICATE-MISMATCH-001",
      "profile_id": "P0",
      "expected_decision": "ACCEPT",
      "expected_primary_reason": "OK",
      "catalog_json_pointer": "/cases/4/profile_expectations/P0"
    },
    {
      "case_id": "BUILDER-PREDICATE-MISMATCH-001",
      "profile_id": "P1",
      "expected_decision": "ACCEPT",
      "expected_primary_reason": "OK",
      "catalog_json_pointer": "/cases/4/profile_expectations/P1"
    },
    {
      "case_id": "BUILDER-PREDICATE-MISMATCH-001",
      "profile_id": "P2",
      "expected_decision": "ACCEPT",
      "expected_primary_reason": "OK",
      "catalog_json_pointer": "/cases/4/profile_expectations/P2"
    },
    {
      "case_id": "BUILDER-PREDICATE-MISMATCH-001",
      "profile_id": "P3",
      "expected_decision": "REJECT",
      "expected_primary_reason": "BUILDER_UNAUTHORIZED",
      "catalog_json_pointer": "/cases/4/profile_expectations/P3"
    },
    {
      "case_id": "CERTIFICATE-TIME-001",
      "profile_id": "P0",
      "expected_decision": "ACCEPT",
      "expected_primary_reason": "OK",
      "catalog_json_pointer": "/cases/5/profile_expectations/P0"
    },
    {
      "case_id": "CERTIFICATE-TIME-001",
      "profile_id": "P1",
      "expected_decision": "ACCEPT",
      "expected_primary_reason": "OK",
      "catalog_json_pointer": "/cases/5/profile_expectations/P1"
    },
    {
      "case_id": "CERTIFICATE-TIME-001",
      "profile_id": "P2",
      "expected_decision": "REJECT",
      "expected_primary_reason": "CERTIFICATE_TIME_INVALID",
      "catalog_json_pointer": "/cases/5/profile_expectations/P2"
    },
    {
      "case_id": "CERTIFICATE-TIME-001",
      "profile_id": "P3",
      "expected_decision": "REJECT",
      "expected_primary_reason": "CERTIFICATE_TIME_INVALID",
      "catalog_json_pointer": "/cases/5/profile_expectations/P3"
    },
    {
      "case_id": "CLEAN-001",
      "profile_id": "P0",
      "expected_decision": "ACCEPT",
      "expected_primary_reason": "OK",
      "catalog_json_pointer": "/cases/6/profile_expectations/P0"
    },
    {
      "case_id": "CLEAN-001",
      "profile_id": "P1",
      "expected_decision": "ACCEPT",
      "expected_primary_reason": "OK",
      "catalog_json_pointer": "/cases/6/profile_expectations/P1"
    },
    {
      "case_id": "CLEAN-001",
      "profile_id": "P2",
      "expected_decision": "ACCEPT",
      "expected_primary_reason": "OK",
      "catalog_json_pointer": "/cases/6/profile_expectations/P2"
    },
    {
      "case_id": "CLEAN-001",
      "profile_id": "P3",
      "expected_decision": "ACCEPT",
      "expected_primary_reason": "OK",
      "catalog_json_pointer": "/cases/6/profile_expectations/P3"
    },
    {
      "case_id": "CONTENT-BITFLIP-001",
      "profile_id": "P0",
      "expected_decision": "ACCEPT",
      "expected_primary_reason": "OK",
      "catalog_json_pointer": "/cases/7/profile_expectations/P0"
    },
    {
      "case_id": "CONTENT-BITFLIP-001",
      "profile_id": "P1",
      "expected_decision": "REJECT",
      "expected_primary_reason": "DIGEST_MISMATCH",
      "catalog_json_pointer": "/cases/7/profile_expectations/P1"
    },
    {
      "case_id": "CONTENT-BITFLIP-001",
      "profile_id": "P2",
      "expected_decision": "ACCEPT",
      "expected_primary_reason": "OK",
      "catalog_json_pointer": "/cases/7/profile_expectations/P2"
    },
    {
      "case_id": "CONTENT-BITFLIP-001",
      "profile_id": "P3",
      "expected_decision": "REJECT",
      "expected_primary_reason": "DIGEST_MISMATCH",
      "catalog_json_pointer": "/cases/7/profile_expectations/P3"
    },
    {
      "case_id": "CONTENT-SAME-SIZE-001",
      "profile_id": "P0",
      "expected_decision": "ACCEPT",
      "expected_primary_reason": "OK",
      "catalog_json_pointer": "/cases/8/profile_expectations/P0"
    },
    {
      "case_id": "CONTENT-SAME-SIZE-001",
      "profile_id": "P1",
      "expected_decision": "REJECT",
      "expected_primary_reason": "DIGEST_MISMATCH",
      "catalog_json_pointer": "/cases/8/profile_expectations/P1"
    },
    {
      "case_id": "CONTENT-SAME-SIZE-001",
      "profile_id": "P2",
      "expected_decision": "ACCEPT",
      "expected_primary_reason": "OK",
      "catalog_json_pointer": "/cases/8/profile_expectations/P2"
    },
    {
      "case_id": "CONTENT-SAME-SIZE-001",
      "profile_id": "P3",
      "expected_decision": "REJECT",
      "expected_primary_reason": "DIGEST_MISMATCH",
      "catalog_json_pointer": "/cases/8/profile_expectations/P3"
    },
    {
      "case_id": "CONTENT-TRUNCATE-001",
      "profile_id": "P0",
      "expected_decision": "ACCEPT",
      "expected_primary_reason": "OK",
      "catalog_json_pointer": "/cases/9/profile_expectations/P0"
    },
    {
      "case_id": "CONTENT-TRUNCATE-001",
      "profile_id": "P1",
      "expected_decision": "REJECT",
      "expected_primary_reason": "SIZE_MISMATCH",
      "catalog_json_pointer": "/cases/9/profile_expectations/P1"
    },
    {
      "case_id": "CONTENT-TRUNCATE-001",
      "profile_id": "P2",
      "expected_decision": "ACCEPT",
      "expected_primary_reason": "OK",
      "catalog_json_pointer": "/cases/9/profile_expectations/P2"
    },
    {